Title,Year,Runtime,Actors,IMDB Rating,Metascore,IMDB Votes,Box Office,Budget,Revenue,TMDB Rating,Vote Count,Month,Day,Action,Adventure,Animation,Biography,Comedy,Crime,Documentary,Drama,Family,Fantasy,Film-Noir,History,Horror,Music,Musical,Mystery,Romance,Sci-Fi,Sport,Thriller,War,Western,Approved,G,GP,M,M/PG,NC-17,Not Rated,PG,PG-13,R,TV-MA,Unrated,Top_Production_Company,Top_Director,Top_Writer,Domestic,International,English_Language,Other_Language,Oscars_Won,Oscars_Nominated,Wins,Nominations,Descr_Sentiment,Tagline_Sentiment
A History of Violence,2005,96,"Viggo Mortensen, Maria Bello, Ed Harris",7.4,82.0,266221,31504633.0,32000000,61477797,7.165,3439,9,30,1,0,0,0,0,1,0,1,0,0,0,0,0,0,0,0,0,0,0,0,0,0,0,0,0,0,0,0,0,0,0,1,0,0,1,0,0,1,0,1,0,0,2,37,84,0,1
The Fast and the Furious,2001,106,"Vin Diesel, Paul Walker, Michelle Rodriguez",6.8,58.0,440247,144745925.0,38000000,207283925,6.994,10326,6,22,1,0,0,0,0,1,0,0,0,0,0,0,0,0,0,0,0,0,0,1,0,0,0,0,0,0,0,0,0,0,1,0,0,0,1,0,0,1,0,1,0,0,0,11,18,1,1
The Prince of Egypt,1998,99,"Val Kilmer, Ralph Fiennes, Michelle Pfeiffer",7.2,64.0,155281,101413188.0,70000000,218613188,7.293,4095,12,18,0,1,1,0,0,0,0,1,0,0,0,0,0,0,0,0,0,0,0,0,0,0,0,0,0,0,0,0,0,1,0,0,0,0,1,0,0,1,0,1,0,1,0,12,27,1,1
The Dead Don't Die,2019,104,"Bill Murray, Adam Driver, Tilda Swinton",5.4,53.0,97839,6563605.0,11000000,15800000,5.44,2690,6,14,0,0,0,0,1,0,0,0,0,1,0,0,1,0,0,0,0,0,0,0,0,0,0,0,0,0,0,0,0,0,0,1,0,0,1,0,0,1,0,1,0,0,0,2,7,1,1
Police Academy,1984,96,"Steve Guttenberg, G.W. Bailey, Kim Cattrall",6.7,41.0,144957,81198894.0,4500000,81198894,6.691,2792,3,23,0,0,0,0,1,0,0,0,0,0,0,0,0,0,0,0,0,0,0,0,0,0,0,0,0,0,0,0,0,0,0,1,0,0,1,0,0,1,0,1,0,0,0,2,2,0,0
X-Men: Days of Future Past,2014,132,"Patrick Stewart, Ian McKellen, Hugh Jackman",7.9,75.0,773918,233921534.0,250000000,747862775,7.528,15668,5,23,1,1,0,0,0,0,0,0,0,0,0,0,0,0,0,0,0,1,0,0,0,0,0,0,0,0,0,0,0,0,1,0,0,0,1,1,0,0,1,1,0,0,1,16,48,0,0
The Village,2004,108,"Sigourney Weaver, William Hurt, Joaquin Phoenix",6.6,44.0,287306,114197520.0,60000000,256700000,6.482,4346,7,30,0,0,0,0,0,0,0,1,0,0,0,0,0,0,0,1,0,0,0,1,0,0,0,0,0,0,0,0,0,0,1,0,0,0,0,1,0,1,0,1,0,0,1,4,24,1,1
Den of Thieves,2018,140,"Gerard Butler, Pablo Schreiber, O'Shea Jackson Jr.",7.0,49.0,145892,44947622.0,30000000,80509622,6.9,3174,1,19,1,0,0,0,0,1,0,1,0,0,0,0,0,0,0,0,0,0,0,0,0,0,0,0,0,0,0,0,0,0,0,1,0,0,1,0,0,1,0,1,0,0,0,0,1,1,1
Armageddon,1998,151,"Bruce Willis, Billy Bob Thornton, Ben Affleck",6.7,42.0,467931,201578182.0,140000000,553799566,6.838,8200,7,1,1,1,0,0,0,0,0,0,0,0,0,0,0,0,0,0,0,1,0,0,0,0,0,0,0,0,0,0,0,0,1,0,0,0,0,1,0,1,0,1,0,0,4,15,41,0,1
Knights of the Zodiac,2023,112,"Mackenyu, Famke Janssen, Madison Iseman",4.4,35.0,15545,1090155.0,60000000,7000000,6.336,1208,5,12,1,1,0,0,0,0,0,1,0,0,0,0,0,0,0,0,0,0,0,0,0,0,0,0,0,0,0,0,0,0,1,0,0,0,0,0,0,1,0,1,0,0,0,0,1,1,1
Angel Has Fallen,2019,121,"Gerard Butler, Frederick Schmidt, Danny Huston",6.4,45.0,118287,69030436.0,40000000,146661977,6.595,3640,8,23,1,0,0,0,0,0,0,0,0,0,0,0,0,0,0,0,0,0,0,1,0,0,0,0,0,0,0,0,0,0,0,1,0,0,0,0,0,1,0,1,0,0,0,0,1,1,0
Dr. No,1962,110,"Sean Connery, Ursula Andress, Bernard Lee",7.2,78.0,187329,16067035.0,1000000,59000000,6.999,3784,10,10,1,1,0,0,0,0,0,0,0,0,0,0,0,0,0,0,0,0,0,1,0,0,0,0,0,0,0,0,0,1,0,0,0,0,1,0,0,0,1,1,0,0,0,4,4,1,1
Before the Devil Knows You're Dead,2007,117,"Philip Seymour Hoffman, Ethan Hawke, Albert Finney",7.3,86.0,115145,7084227.0,18000000,25005257,7.109,1588,10,26,0,0,0,0,0,1,0,1,0,0,0,0,0,0,0,0,0,0,0,1,0,0,0,0,0,0,0,0,0,0,0,1,0,0,0,0,0,1,0,1,0,0,0,17,28,0,1
Face/Off,1997,138,"John Travolta, Nicolas Cage, Joan Allen",7.3,82.0,416593,112276146.0,80000000,245700000,7.046,5549,6,27,1,0,0,0,0,1,0,0,0,0,0,0,0,0,0,0,0,1,0,0,0,0,0,0,0,0,0,0,0,0,0,1,0,0,1,0,0,1,0,1,0,0,1,11,23,0,0
Pirates of the Caribbean: On Stranger Tides,2011,136,"Johnny Depp, Penélope Cruz, Ian McShane",6.6,45.0,590595,241071802.0,379000000,1046721266,6.561,14386,5,20,1,1,0,0,0,0,0,0,0,1,0,0,0,0,0,0,0,0,0,0,0,0,0,0,0,0,0,0,0,0,1,0,0,0,1,0,0,1,0,1,0,0,0,3,31,1,0
Billy Madison,1995,89,"Adam Sandler, Darren McGavin, Bridgette Wilson-Sampras",6.4,16.0,162124,25588734.0,10000000,26488734,6.182,1694,2,10,0,0,0,0,1,0,0,0,0,0,0,0,0,0,0,0,0,0,0,0,0,0,0,0,0,0,0,0,0,0,1,0,0,0,1,0,0,1,0,1,0,0,0,0,1,0,0
Gone with the Wind,1940,238,"Clark Gable, Vivien Leigh, Thomas Mitchell",8.2,97.0,346019,200882193.0,4000000,402352579,7.926,4170,1,17,0,0,0,0,0,0,0,1,0,0,0,0,0,0,0,0,1,0,0,0,1,0,0,1,0,0,0,0,0,0,0,0,0,0,1,0,0,1,0,1,0,8,0,25,9,1,1
Indiana Jones and the Temple of Doom,1984,118,"Harrison Ford, Kate Capshaw, Ke Huy Quan",7.5,57.0,555038,179870271.0,28000000,333000000,7.303,9622,5,23,1,1,0,0,0,0,0,0,0,0,0,0,0,0,0,0,0,0,0,0,0,0,0,0,0,0,0,0,0,1,0,0,0,0,1,1,0,1,0,1,0,1,0,11,22,1,0
Dracula Untold,2014,92,"Luke Evans, Dominic Cooper, Sarah Gadon",6.2,40.0,216506,56280355.0,70000000,217124280,6.4,6252,10,10,1,0,0,0,0,0,0,1,0,1,0,0,0,0,0,0,0,0,0,0,0,0,0,0,0,0,0,0,0,0,1,0,0,0,1,0,0,0,1,1,0,0,0,3,5,0,1
Big Fish,2004,125,"Ewan McGregor, Albert Finney, Billy Crudup",8.0,58.0,471009,66809693.0,70000000,123200000,7.758,7406,1,9,0,1,0,0,0,0,0,1,0,1,0,0,0,0,0,0,0,0,0,0,0,0,0,0,0,0,0,0,0,0,1,0,0,0,1,1,0,1,0,1,0,0,1,0,69,1,1
Jason Bourne,2016,123,"Matt Damon, Tommy Lee Jones, Alicia Vikander",6.6,58.0,251416,162434410.0,120000000,415484914,6.365,5887,7,29,1,0,0,0,0,0,0,0,0,0,0,0,0,0,0,0,0,0,0,1,0,0,0,0,0,0,0,0,0,0,1,0,0,0,0,0,0,1,0,1,0,0,0,3,20,1,1
Lilo & Stitch,2002,85,"Daveigh Chase, Chris Sanders, Tia Carrere",7.4,75.0,234520,145794338.0,100000000,1009924653,7.326,1110,6,21,0,1,1,0,1,0,0,0,0,0,0,0,0,0,0,0,0,0,0,0,0,0,0,0,0,0,0,0,0,1,0,0,0,0,1,0,0,1,0,1,0,0,1,12,28,1,1
The Fast and the Furious: Tokyo Drift,2006,104,"Lucas Black, Zachery Ty Bryan, Shad Moss",6.1,45.0,318212,62514415.0,85000000,158964610,6.5,7181,6,16,1,0,0,0,0,1,0,0,0,0,0,0,0,0,0,0,0,0,0,1,0,0,0,0,0,0,0,0,0,0,1,0,0,0,1,0,0,0,1,1,0,0,0,1,4,1,0
Upgrade,2018,100,"Logan Marshall-Green, Melanie Vallejo, Steve Danielsen",7.5,67.0,225258,11977130.0,5000000,16706680,7.496,4622,6,1,1,0,0,0,0,0,0,0,0,0,0,0,0,0,0,0,0,1,0,1,0,0,0,0,0,0,0,0,0,0,0,1,0,0,0,0,0,1,0,1,0,0,0,3,26,0,0
Moonlight,2016,111,"Mahershala Ali, Naomie Harris, Trevante Rhodes",7.4,99.0,341808,27854932.0,4000000,65046687,7.37,7225,11,18,0,0,0,0,0,0,0,1,0,0,0,0,0,0,0,0,0,0,0,0,0,0,0,0,0,0,0,0,0,0,0,1,0,0,1,0,0,1,0,1,0,3,0,235,310,0,1
I Know What You Did Last Summer,1997,101,"Jennifer Love Hewitt, Sarah Michelle Gellar, Anne Heche",5.8,52.0,165924,72586134.0,18000000,29000823,5.9,99,10,17,0,0,0,0,0,0,0,0,0,0,0,0,1,0,0,1,0,0,0,0,0,0,0,0,0,0,0,0,0,0,0,1,0,0,1,0,0,1,0,1,0,0,0,4,10,0,1
The Fugitive,1993,130,"Harrison Ford, Tommy Lee Jones, Sela Ward",7.8,87.0,334630,183875760.0,44000000,183875799,7.466,4468,8,6,1,0,0,0,0,1,0,1,0,0,0,0,0,0,0,0,0,0,0,0,0,0,0,0,0,0,0,0,0,0,1,0,0,0,1,0,0,1,0,1,0,1,0,13,37,1,1
The Impossible,2013,114,"Naomi Watts, Ewan McGregor, Tom Holland",7.5,73.0,257301,19019882.0,45000000,198100000,7.367,6431,1,4,0,0,0,0,0,0,0,1,0,0,0,1,0,0,0,0,0,0,0,1,0,0,0,0,0,0,0,0,0,0,1,0,0,0,0,0,0,0,1,1,0,0,1,28,70,1,1
2 Guns,2013,109,"Denzel Washington, Mark Wahlberg, Paula Patton",6.7,55.0,233003,75612460.0,61000000,131940411,6.538,4255,8,2,1,0,0,0,1,1,0,0,0,0,0,0,0,0,0,0,0,0,0,0,0,0,0,0,0,0,0,0,0,0,0,1,0,0,1,0,0,1,0,1,0,0,0,3,0,0,1
Toy Story 3,2010,103,"Tom Hanks, Tim Allen, Joan Cusack",8.3,92.0,938919,415004880.0,200000000,1067316101,7.8,15069,6,18,0,1,1,0,1,0,0,0,0,0,0,0,0,0,0,0,0,0,0,0,0,0,0,1,0,0,0,0,0,0,0,0,0,0,1,0,0,1,0,1,0,2,0,63,96,0,0
Hotel Transylvania,2012,91,"Adam Sandler, Kevin James, Andy Samberg",7.0,47.0,298729,148426305.0,85000000,358375603,6.962,8823,9,28,0,0,1,0,1,0,0,0,1,0,0,0,0,0,0,0,0,0,0,0,0,0,0,0,0,0,0,0,0,1,0,0,0,0,1,0,0,1,0,1,0,0,0,2,15,0,0
Weird Science,1985,94,"Anthony Michael Hall, Ilan Mitchell-Smith, Kelly LeBrock",6.6,46.0,102435,23834048.0,7500000,38934048,6.557,1450,8,2,0,0,0,0,1,0,0,0,0,0,0,0,0,0,0,0,1,1,0,0,0,0,0,0,0,0,0,0,0,0,1,0,0,0,1,0,1,1,0,1,0,0,0,0,2,1,1
Mean Streets,1973,112,"Robert De Niro, Harvey Keitel, David Proval",7.2,96.0,124697,32645.0,500000,3000000,7.1,2172,10,14,0,0,0,0,0,1,0,1,0,0,0,0,0,0,0,0,0,0,0,1,0,0,0,0,0,0,0,0,0,0,0,1,0,0,0,0,0,1,0,1,0,0,0,5,5,0,0
Maleficent,2014,97,"Angelina Jolie, Elle Fanning, Sharlto Copley",6.9,56.0,414876,241410378.0,180000000,758539785,7.089,13354,5,30,1,1,0,0,0,0,0,1,0,0,0,0,0,0,0,0,0,0,0,0,0,0,0,0,0,0,0,0,0,1,0,0,0,0,1,0,0,1,0,1,0,0,1,12,44,1,0
Saturday Night Fever,1977,118,"John Travolta, Karen Lynn Gorney, Barry Miller",6.8,77.0,90015,94213184.0,3500000,237113184,6.7,1981,12,16,0,0,0,0,0,0,0,1,0,0,0,0,0,1,0,0,0,0,0,0,0,0,0,0,0,0,0,0,0,0,0,1,0,0,1,0,0,1,0,1,0,0,1,6,14,1,0
Doctor Strange,2016,115,"Benedict Cumberbatch, Chiwetel Ejiofor, Rachel McAdams",7.5,72.0,845476,232641920.0,180000000,676343174,7.419,22665,11,4,1,1,0,0,0,0,0,0,0,1,0,0,0,0,0,0,0,0,0,0,0,0,0,0,0,0,0,0,0,0,1,0,0,0,1,0,0,1,0,1,0,0,1,21,68,1,0
Margin Call,2011,107,"Zachary Quinto, Stanley Tucci, Kevin Spacey",7.1,76.0,154319,5354039.0,3500000,19504039,6.86,1906,9,29,0,0,0,0,0,0,0,1,0,0,0,0,0,0,0,0,0,0,0,1,0,0,0,0,0,0,0,0,0,0,0,1,0,0,0,0,0,1,0,1,0,0,1,8,24,0,0
Piranha 3D,2010,88,"Elisabeth Shue, Jerry O'Connell, Richard Dreyfuss",5.5,53.0,99898,25003155.0,24000000,83188165,5.405,2288,8,20,0,0,0,0,1,0,0,0,0,0,0,0,1,0,0,0,0,0,0,0,0,0,0,0,0,0,0,0,0,0,0,1,0,0,0,0,0,0,1,1,0,0,0,2,12,1,1
Blood Diamond,2006,143,"Leonardo DiCaprio, Djimon Hounsou, Jennifer Connelly",8.0,64.0,606230,57377916.0,100000000,171700000,7.549,7888,12,8,0,1,0,0,0,0,0,1,0,0,0,0,0,0,0,0,0,0,0,1,0,0,0,0,0,0,0,0,0,0,0,1,0,0,1,0,0,1,0,1,0,0,5,8,32,1,1
A League of Their Own,1992,128,"Tom Hanks, Geena Davis, Lori Petty",7.4,69.0,126544,107533928.0,40000000,132440069,7.2,1449,7,1,0,0,0,0,1,0,0,1,0,0,0,0,0,0,0,0,0,0,1,0,0,0,0,0,0,0,0,0,0,1,0,0,0,0,1,0,0,1,0,1,0,0,0,6,13,0,1
Wonder,2017,113,"Jacob Tremblay, Owen Wilson, Izabela Vidovic",7.9,66.0,187877,132422809.0,20000000,315025930,8.1,8032,11,17,0,0,0,0,0,0,0,1,1,0,0,0,0,0,0,0,0,0,0,0,0,0,0,0,0,0,0,0,0,1,0,0,0,0,1,0,0,1,0,1,0,0,1,5,28,1,1
Transformers: Dark of the Moon,2011,154,"Shia LaBeouf, Rosie Huntington-Whiteley, Tyrese Gibson",6.2,42.0,446041,352390543.0,195000000,1123794079,6.216,8552,6,29,1,1,0,0,1,0,0,0,0,0,0,0,0,0,0,0,0,0,0,0,0,0,0,0,0,0,0,0,0,0,1,0,0,0,1,1,0,1,0,1,0,0,3,11,42,1,0
Forgetting Sarah Marshall,2008,111,"Kristen Bell, Jason Segel, Paul Rudd",7.1,67.0,313215,63172463.0,30000000,105173115,6.503,3494,4,18,0,0,0,0,1,0,0,1,0,0,0,0,0,0,0,0,1,0,0,0,0,0,0,0,0,0,0,0,0,0,0,1,0,0,1,0,0,1,0,1,0,0,0,4,19,1,0
Knock at the Cabin,2023,100,"Dave Bautista, Jonathan Groff, Ben Aldridge",6.1,63.0,135005,35397980.0,20000000,54700000,6.275,2846,2,3,0,0,0,0,0,0,0,0,0,0,0,0,1,0,0,1,0,0,0,1,0,0,0,0,0,0,0,0,0,0,0,1,0,0,0,1,0,1,0,1,0,0,0,0,12,0,1
Ant-Man and the Wasp: Quantumania,2023,124,"Paul Rudd, Evangeline Lilly, Michael Douglas",6.0,48.0,252231,214504909.0,388369742,476071180,6.271,5352,2,17,1,1,0,0,1,0,0,0,0,0,0,0,0,0,0,0,0,0,0,0,0,0,0,0,0,0,0,0,0,0,1,0,0,0,1,0,0,1,0,1,0,0,0,0,14,1,1
Soul,2020,100,"Jamie Foxx, Tina Fey, Graham Norton",8.0,83.0,412080,946154.0,150000000,121977511,8.107,10855,11,29,0,1,1,0,1,0,0,0,0,0,0,0,0,0,0,0,0,0,0,0,0,0,0,0,0,0,0,0,0,1,0,0,0,0,0,0,0,1,0,1,0,2,0,124,91,1,1
G.I. Jane,1997,125,"Demi Moore, Viggo Mortensen, Anne Bancroft",6.0,62.0,90697,48169156.0,50000000,48169156,6.469,1741,8,22,1,0,0,0,0,0,0,1,0,0,0,0,0,0,0,0,0,0,0,0,1,0,0,0,0,0,0,0,0,0,0,1,0,0,0,1,0,1,0,1,0,0,0,2,3,0,0
Captain Marvel,2019,123,"Brie Larson, Samuel L. Jackson, Ben Mendelsohn",6.7,64.0,642091,426829839.0,152000000,1131416446,6.798,16167,3,8,1,1,0,0,0,0,0,0,0,0,0,0,0,0,0,0,0,1,0,0,0,0,0,0,0,0,0,0,0,0,1,0,0,0,1,0,0,1,0,1,0,0,0,10,56,1,1
The Beach,2000,119,"Leonardo DiCaprio, Tilda Swinton, Daniel York Loh",6.6,43.0,260896,39785027.0,40000000,144056873,6.489,4483,2,11,0,1,0,0,0,0,0,1,0,0,0,0,0,0,0,0,1,0,0,0,0,0,0,0,0,0,0,0,0,0,0,1,0,0,0,0,0,0,1,1,0,0,0,0,7,0,1
Gummo,1997,89,"Nick Sutton, Jacob Sewell, Lara Tosh",6.6,19.0,39324,116799.0,1300000,116799,6.6,662,11,24,0,0,0,0,1,0,0,1,0,0,0,0,0,0,0,0,0,0,0,0,0,0,0,0,0,0,0,0,0,0,0,1,0,0,0,0,0,1,0,1,0,0,0,4,2,0,1
Don't Breathe,2016,88,"Stephen Lang, Jane Levy, Dylan Minnette",7.1,71.0,319088,89217875.0,9900000,158906350,7.016,7637,8,26,0,0,0,0,0,1,0,0,0,0,0,0,1,0,0,0,0,0,0,1,0,0,0,0,0,0,0,0,0,0,0,1,0,0,0,0,0,1,0,1,0,0,0,7,21,0,0
The Bourne Supremacy,2004,108,"Matt Damon, Franka Potente, Joan Allen",7.7,73.0,502072,176241941.0,75000000,288500217,7.323,7743,7,23,1,0,0,0,0,0,0,0,0,0,0,0,0,0,0,1,0,0,0,1,0,0,0,0,0,0,0,0,0,0,1,0,0,0,1,0,0,1,0,1,0,0,0,5,22,1,0
Wedding Crashers,2005,119,"Owen Wilson, Vince Vaughn, Rachel McAdams",7.0,64.0,388328,209273411.0,40000000,288500000,6.494,4479,7,15,0,0,0,0,1,0,0,0,0,0,0,0,0,0,0,0,1,0,0,0,0,0,0,0,0,0,0,0,0,0,0,1,0,0,1,0,0,1,0,1,0,0,0,11,11,1,0
Olympus Has Fallen,2013,119,"Gerard Butler, Aaron Eckhart, Morgan Freeman",6.5,41.0,300659,98925640.0,70000000,170270201,6.405,6752,3,22,1,0,0,0,0,0,0,0,0,0,0,0,0,0,0,0,0,0,0,1,0,0,0,0,0,0,0,0,0,0,0,1,0,0,0,0,0,1,0,1,0,0,0,1,5,0,1
"Lock, Stock and Two Smoking Barrels",1998,107,"Jason Flemyng, Dexter Fletcher, Nick Moran",8.1,67.0,635182,3753929.0,1350000,28356188,8.111,6815,8,28,0,0,0,0,1,1,0,0,0,0,0,0,0,0,0,0,0,0,0,0,0,0,0,0,0,0,0,0,0,0,0,1,0,0,0,0,0,0,1,1,0,0,0,13,9,0,0
Inside Man,2006,129,"Denzel Washington, Clive Owen, Jodie Foster",7.6,76.0,415481,88513495.0,45000000,186003591,7.396,6009,3,24,0,0,0,0,0,1,0,1,0,0,0,0,0,0,0,1,0,0,0,0,0,0,0,0,0,0,0,0,0,0,0,1,0,0,1,0,0,1,0,1,0,0,0,5,12,0,0
Insidious,2011,103,"Patrick Wilson, Rose Byrne, Ty Simpkins",6.8,52.0,354238,54009150.0,1500000,100106454,6.944,6995,4,1,0,0,0,0,0,0,0,0,0,0,0,0,1,0,0,1,0,0,0,1,0,0,0,0,0,0,0,0,0,0,1,0,0,0,0,1,0,1,0,1,0,0,0,8,16,1,1
A Haunting in Venice,2023,103,"Kenneth Branagh, Michelle Yeoh, Jamie Dornan",6.5,63.0,132912,42471412.0,60000000,121400000,6.596,2549,9,15,0,0,0,0,0,1,0,1,0,0,0,0,1,0,0,0,0,0,0,0,0,0,0,0,0,0,0,0,0,0,1,0,0,0,0,0,0,1,0,1,0,0,0,6,4,1,0
Hitman,2007,94,"Timothy Olyphant, Dougray Scott, Olga Kurylenko",6.2,35.0,182840,39687694.0,24000000,101276318,6.139,3454,11,21,1,0,0,0,0,1,0,0,0,0,0,0,0,0,0,0,0,0,0,1,0,0,0,0,0,0,0,0,0,0,0,1,0,0,0,0,0,0,1,1,0,0,0,2,0,1,0
The Graduate,1967,106,"Dustin Hoffman, Anne Bancroft, Katharine Ross",8.0,83.0,296344,104945305.0,3000000,104945305,7.635,3475,12,21,0,0,0,0,1,0,0,1,0,0,0,0,0,0,0,0,1,0,0,0,0,0,0,0,0,0,0,0,0,1,0,0,0,0,0,0,0,1,0,1,0,1,0,22,17,1,0
The Evil Dead,1983,85,"Bruce Campbell, Ellen Sandweiss, Richard DeManincor",7.4,71.0,243336,2400000.0,350000,29612367,7.279,4175,4,15,0,0,0,0,0,0,0,0,0,0,0,0,1,0,0,0,0,0,0,0,0,0,0,0,0,0,0,1,0,0,0,0,0,0,0,1,0,1,0,1,0,0,0,5,1,0,0
Big Hero 6,2014,102,"Ryan Potter, Scott Adsit, Jamie Chung",7.8,74.0,531564,222527828.0,165000000,657870525,7.727,15996,11,7,1,1,1,0,0,0,0,0,0,0,0,0,0,0,0,0,0,0,0,0,0,0,0,0,0,0,0,0,0,1,0,0,0,0,1,0,0,1,0,1,0,1,0,17,58,1,1
Unstoppable,2010,98,"Denzel Washington, Chris Pine, Rosario Dawson",6.8,69.0,212826,81562942.0,100000000,167805466,6.596,3669,11,12,1,0,0,0,0,0,0,0,0,0,0,0,0,0,0,0,0,0,0,1,0,0,0,0,0,0,0,0,0,0,1,0,0,0,1,0,0,1,0,1,0,0,1,1,14,0,0
As Good as It Gets,1997,139,"Jack Nicholson, Helen Hunt, Greg Kinnear",7.7,67.0,329193,148478011.0,50000000,314178011,7.396,3907,12,25,0,0,0,0,1,0,0,1,0,0,0,0,0,0,0,0,1,0,0,0,0,0,0,0,0,0,0,0,0,0,1,0,0,0,0,0,0,1,0,1,0,2,0,38,54,0,1
Bad Santa,2003,92,"Billy Bob Thornton, Bernie Mac, Lauren Graham",7.0,70.0,161546,60060328.0,23000000,76500000,6.548,2217,11,26,0,0,0,0,1,1,0,1,0,0,0,0,0,0,0,0,0,0,0,0,0,0,0,0,0,0,0,0,0,0,0,1,0,0,0,0,0,0,1,1,0,0,0,1,12,0,0
Bottoms,2024,91,"Rachel Sennott, Ayo Edebiri, Ruby Cruz",6.7,74.0,53441,12036071.0,11300000,12976079,6.752,709,2,14,0,0,0,0,1,0,0,0,0,0,0,0,0,0,0,0,0,0,0,0,0,0,0,0,0,0,0,0,0,0,0,1,0,0,1,0,0,1,0,1,0,0,0,5,24,0,1
Chinatown,1974,130,"Jack Nicholson, Faye Dunaway, John Huston",8.1,92.0,364484,29200000.0,6000000,30000000,7.915,3986,6,20,0,0,0,0,0,0,0,1,0,0,0,0,0,0,0,1,0,0,0,1,0,0,0,0,0,0,0,0,0,0,0,1,0,0,1,0,0,1,0,1,0,1,0,21,24,1,1
Sonic the Hedgehog 2,2022,122,"James Marsden, Jim Carrey, Ben Schwartz",6.5,47.0,107965,190872904.0,110000000,405421518,7.464,5567,4,8,1,1,0,0,1,0,0,0,0,0,0,0,0,0,0,0,0,0,0,0,0,0,0,0,0,0,0,0,0,1,0,0,0,0,1,0,0,1,0,1,0,0,0,2,3,1,1
A Bad Moms Christmas,2017,104,"Mila Kunis, Kristen Bell, Kathryn Hahn",5.6,42.0,60575,72110659.0,28000000,130560428,6.317,2132,11,1,0,0,0,0,1,0,0,0,0,0,0,0,0,0,0,0,0,0,0,0,0,0,0,0,0,0,0,0,0,0,0,1,0,0,1,0,0,1,0,1,0,0,0,1,1,1,1
Iron Man 2,2010,124,"Robert Downey Jr., Mickey Rourke, Gwyneth Paltrow",6.9,57.0,909600,312433331.0,200000000,623933331,6.849,21578,5,7,1,0,0,0,0,0,0,0,0,0,0,0,0,0,0,0,0,1,0,0,0,0,0,0,0,0,0,0,0,0,1,0,0,0,1,1,0,1,0,1,0,0,1,7,45,1,1
You've Got Mail,1998,119,"Tom Hanks, Meg Ryan, Greg Kinnear",6.7,58.0,238946,115821495.0,65000000,250800000,6.69,3421,12,18,0,0,0,0,1,0,0,1,0,0,0,0,0,0,0,0,1,0,0,0,0,0,0,0,0,0,0,0,0,1,0,0,0,0,1,0,0,1,0,1,0,0,0,6,8,1,1
Aladdin,1992,90,"Scott Weinger, Robin Williams, Linda Larkin",8.0,86.0,488970,217350219.0,183000000,1097831681,7.096,10280,11,25,0,1,1,0,1,0,0,0,0,0,0,0,0,0,0,0,0,0,0,0,0,0,0,1,0,0,0,0,0,0,0,0,0,0,1,0,0,1,0,1,0,2,0,35,22,1,1
The Bone Collector,1999,118,"Denzel Washington, Angelina Jolie, Queen Latifah",6.7,45.0,193520,66518655.0,73000000,151493655,6.8,3654,11,5,0,0,0,0,0,1,0,1,0,0,0,0,0,0,0,1,0,0,0,0,0,0,0,0,0,0,0,0,0,0,0,1,0,0,1,0,0,1,0,1,0,0,0,1,3,0,0
First Man,2018,141,"Ryan Gosling, Claire Foy, Jason Clarke",7.3,84.0,210807,44936545.0,70000000,105713218,7.041,5401,10,12,0,0,0,1,0,0,0,1,0,0,0,1,0,0,0,0,0,0,0,0,0,0,0,0,0,0,0,0,0,0,1,0,0,0,1,0,0,0,1,1,0,1,0,32,192,1,1
Shallow Hal,2001,114,"Jack Black, Gwyneth Paltrow, Jason Alexander",6.0,48.0,150221,70839203.0,40000000,141069860,6.162,2973,11,9,0,0,0,0,1,0,0,1,0,1,0,0,0,0,0,0,0,0,0,0,0,0,0,0,0,0,0,0,0,0,1,0,0,0,1,0,0,1,0,1,0,0,0,0,3,0,1
RoboCop,1987,102,"Peter Weller, Nancy Allen, Dan O'Herlihy",7.6,70.0,296755,53424681.0,13000000,53424681,7.345,5380,7,17,1,0,0,0,0,1,0,0,0,0,0,0,0,0,0,0,0,1,0,0,0,0,0,0,0,0,0,0,0,0,0,1,0,0,1,0,0,1,0,1,0,0,2,11,13,1,1
Contact,1997,150,"Jodie Foster, Matthew McConaughey, Tom Skerritt",7.5,62.0,304561,100920329.0,90000000,171120329,7.435,4668,7,11,0,0,0,0,0,0,0,1,0,0,0,0,0,0,0,1,0,1,0,0,0,0,0,0,0,0,0,0,0,1,0,0,0,0,1,1,0,1,0,1,0,0,1,14,32,1,1
The Amazing Spider-Man 2,2014,142,"Andrew Garfield, Emma Stone, Jamie Foxx",6.6,53.0,565670,203605622.0,200000000,708962323,6.52,13639,5,2,1,1,0,0,0,0,0,0,0,0,0,0,0,0,0,0,0,1,0,0,0,0,0,0,0,0,0,0,0,0,1,0,0,0,1,0,0,1,0,1,0,0,0,4,30,0,0
American Hustle,2013,138,"Christian Bale, Amy Adams, Bradley Cooper",7.2,90.0,510306,150117807.0,40000000,251171807,6.855,7428,12,20,0,0,0,0,0,1,0,1,0,0,0,0,0,0,0,0,0,0,0,0,0,0,0,0,0,0,0,0,0,0,0,1,0,0,0,0,0,1,0,1,0,0,10,70,228,1,1
Scary Movie 3,2003,84,"Anna Faris, Charlie Sheen, Regina Hall",5.6,49.0,164944,110003217.0,48000000,220673217,5.965,4215,10,24,0,0,0,0,1,0,0,0,0,0,0,0,0,0,0,0,0,0,0,0,0,0,0,0,0,0,0,0,0,0,1,0,0,0,0,0,0,1,0,1,0,0,0,2,4,0,1
North by Northwest,1959,136,"Cary Grant, Eva Marie Saint, James Mason",8.3,98.0,362488,66728.0,4000000,13275000,7.981,4264,12,18,0,1,0,0,0,0,0,1,0,0,0,0,0,0,0,1,0,0,0,0,0,0,1,0,0,0,0,0,0,0,0,0,0,0,1,0,0,1,0,1,0,0,3,9,7,1,1
Vacation,2015,99,"Ed Helms, Christina Applegate, Skyler Gisondo",6.2,34.0,124959,58884188.0,31000000,104400000,6.312,3802,7,29,0,1,0,0,1,0,0,0,0,0,0,0,0,0,0,0,0,0,0,0,0,0,0,0,0,0,0,0,0,0,0,1,0,0,1,0,0,1,0,1,0,0,0,1,3,0,0
A Bronx Tale,1993,121,"Robert De Niro, Chazz Palminteri, Lillo Brancato",7.8,80.0,174751,17287898.0,22000000,17287898,7.9,2642,10,1,0,0,0,0,0,1,0,1,0,0,0,0,0,0,0,0,0,0,0,0,0,0,0,0,0,0,0,0,0,0,0,1,0,0,0,0,0,1,0,1,0,0,0,1,4,1,1
There's Something About Mary,1998,119,"Cameron Diaz, Matt Dillon, Ben Stiller",7.1,69.0,338048,176484651.0,23000000,369900000,6.617,5076,7,15,0,0,0,0,1,0,0,0,0,0,0,0,0,0,0,0,1,0,0,0,0,0,0,0,0,0,0,0,0,0,0,1,0,0,1,0,0,1,0,1,0,0,0,17,17,1,1
Women Talking,2023,104,"Rooney Mara, Claire Foy, Jessie Buckley",6.9,77.0,44731,5456531.0,20000000,7589419,6.891,628,1,27,0,0,0,0,0,0,0,1,0,0,0,0,0,0,0,0,0,0,0,0,0,0,0,0,0,0,0,0,0,0,1,0,0,0,1,0,0,1,0,1,0,1,0,65,164,1,0
A.I. Artificial Intelligence,2001,146,"Haley Joel Osment, Jude Law, Frances O'Connor",7.2,65.0,332043,78616689.0,100000000,235926552,7.047,6340,6,29,0,1,0,0,0,0,0,1,0,0,0,0,0,0,0,0,0,1,0,0,0,0,0,0,0,0,0,0,0,0,1,0,0,0,1,1,0,1,0,1,0,0,2,18,71,1,1
John Wick: Chapter 2,2017,122,"Keanu Reeves, Riccardo Scamarcio, Ian McShane",7.4,75.0,548706,92029184.0,40000000,171539887,7.3,13566,2,10,1,0,0,0,0,1,0,0,0,0,0,0,0,0,0,0,0,0,0,1,0,0,0,0,0,0,0,0,0,0,0,1,0,0,0,0,0,1,0,1,0,0,0,4,10,0,1
Saw X,2023,118,"Tobin Bell, Shawnee Smith, Synnøve Macody Lund",6.6,60.0,91407,53607898.0,13000000,125319714,7.203,2145,9,29,0,0,0,0,0,0,0,0,0,0,0,0,1,0,0,1,0,0,0,1,0,0,0,0,0,0,0,0,0,0,0,1,0,0,1,0,0,1,0,1,0,0,0,1,15,0,1
Leaving Las Vegas,1996,111,"Nicolas Cage, Elisabeth Shue, Julian Sands",7.5,82.0,138732,32029928.0,3600000,49800000,7.2,1518,2,9,0,0,0,0,0,0,0,1,0,0,0,0,0,0,0,0,1,0,0,0,0,0,0,0,0,0,0,0,0,0,0,1,0,0,0,0,0,1,0,1,0,1,0,32,30,0,1
Conan the Barbarian,1982,129,"Arnold Schwarzenegger, James Earl Jones, Max von Sydow",6.9,43.0,168075,39565475.0,20000000,73951475,6.816,2594,5,14,0,1,0,0,0,0,0,0,0,1,0,0,0,0,0,0,0,0,0,0,0,0,0,0,0,0,0,0,0,0,0,1,0,0,1,0,0,1,0,1,0,0,0,2,10,1,1
Mud,2013,130,"Matthew McConaughey, Tye Sheridan, Jacob Lofland",7.4,76.0,195524,21590086.0,10000000,32613173,7.057,2897,5,10,0,1,0,0,0,0,0,1,0,0,0,0,0,0,0,0,0,0,0,0,0,0,0,0,0,0,0,0,0,0,1,0,0,0,0,0,0,1,0,1,0,0,0,15,39,0,0
The Blues Brothers,1980,133,"John Belushi, Dan Aykroyd, Cab Calloway",7.9,60.0,222522,57229890.0,27000000,115229890,7.725,4341,6,20,0,1,0,0,1,1,0,0,0,0,0,0,0,0,0,0,0,0,0,0,0,0,0,0,0,0,0,0,0,0,0,1,0,0,1,0,0,1,0,1,0,0,0,2,1,0,1
2012,2009,158,"John Cusack, Thandiwe Newton, Chiwetel Ejiofor",5.8,49.0,412469,166112167.0,200000000,791217826,5.858,12228,11,13,1,1,0,0,0,0,0,0,0,0,0,0,0,0,0,0,0,1,0,0,0,0,0,0,0,0,0,0,0,0,1,0,0,0,1,1,0,1,0,1,0,0,0,5,21,0,0
"As Above, So Below",2014,93,"Perdita Weeks, Ben Feldman, Edwin Hodge",6.3,39.0,123419,21321100.0,5000000,41900000,6.719,3614,8,29,0,0,0,0,0,0,0,0,0,0,0,0,1,0,0,1,0,0,0,1,0,0,0,0,0,0,0,0,0,0,0,1,0,0,0,0,0,1,0,1,0,0,0,1,6,1,0
Star Wars: Episode II - Attack of the Clones,2002,142,"Hayden Christensen, Natalie Portman, Ewan McGregor",6.6,54.0,796850,310676740.0,120000000,649398328,6.582,13688,5,16,1,1,0,0,0,0,0,0,0,1,0,0,0,0,0,0,0,0,0,0,0,0,0,0,0,0,0,0,0,1,0,0,0,0,0,1,0,1,0,1,0,0,1,21,71,0,0
The Invisible Man,2020,124,"Elisabeth Moss, Oliver Jackson-Cohen, Harriet Dyer",7.1,72.0,271962,70410000.0,7000000,144492724,7.113,5919,2,28,0,0,0,0,0,0,0,1,0,0,0,0,1,0,0,1,0,0,0,0,0,0,0,0,0,0,0,0,0,0,0,1,0,0,1,0,0,0,1,1,0,0,0,43,84,0,0
Gravity,2013,91,"Sandra Bullock, George Clooney, Ed Harris",7.7,96.0,883511,274092705.0,105000000,723192705,7.163,15688,10,4,0,0,0,0,0,0,0,1,0,0,0,0,0,0,0,0,0,1,0,1,0,0,0,0,0,0,0,0,0,0,1,0,0,0,1,0,0,0,1,1,0,7,0,240,188,0,1
Wish,2023,95,"Ariana DeBose, Chris Pine, Alan Tudyk",5.6,47.0,47252,63973821.0,175000000,254997360,6.281,1638,11,22,0,1,1,0,1,0,0,0,0,0,0,0,0,0,0,0,0,0,0,0,0,0,0,0,0,0,0,0,0,1,0,0,0,0,1,0,0,1,0,1,0,0,0,1,22,0,0
We Were Soldiers,2002,138,"Mel Gibson, Madeleine Stowe, Greg Kinnear",7.2,65.0,156493,78122718.0,75000000,114660784,7.1,2124,3,1,1,0,0,0,0,0,0,1,0,0,0,1,0,0,0,0,0,0,0,0,0,0,0,0,0,0,0,0,0,0,0,1,0,0,1,0,0,1,0,1,0,0,0,3,5,1,0
Trolls,2016,92,"Anna Kendrick, Justin Timberlake, Zooey Deschanel",6.4,55.0,97374,154174089.0,125000000,347337803,6.637,3679,11,4,0,1,1,0,1,0,0,0,0,0,0,0,0,0,0,0,0,0,0,0,0,0,0,0,0,0,0,0,0,1,0,0,0,0,1,0,0,1,0,1,0,0,1,4,37,1,1
Holes,2003,117,"Shia LaBeouf, Sigourney Weaver, Jon Voight",7.0,71.0,105721,67406573.0,20000000,71406573,6.873,1441,4,18,0,1,0,0,1,0,0,1,0,0,0,0,0,0,0,0,0,0,0,0,0,0,0,0,0,0,0,0,0,1,0,0,0,0,1,0,0,1,0,1,0,0,0,3,9,0,0
The Sandlot,1993,101,"Tom Guiry, Mike Vitar, Art LaFleur",7.8,55.0,108296,32950136.0,7000000,34348444,7.539,1226,4,7,0,0,0,0,1,0,0,1,1,0,0,0,0,0,0,0,0,0,0,0,0,0,0,0,0,0,0,0,0,1,0,0,0,0,1,0,0,1,0,1,0,0,0,1,1,1,1
Dora and the Lost City of Gold,2019,102,"Isabela Merced, Eugenio Derbez, Michael Peña",6.1,63.0,37829,60477943.0,49000000,120600000,6.637,1772,8,9,1,1,0,0,1,0,0,0,0,0,0,0,0,0,0,0,0,0,0,0,0,0,0,0,0,0,0,0,0,1,0,0,0,0,1,0,0,1,0,1,0,0,0,4,2,1,1
Who Framed Roger Rabbit,1988,104,"Bob Hoskins, Christopher Lloyd, Joanna Cassidy",7.7,83.0,222420,156452370.0,70000000,329800000,7.532,5901,6,22,0,1,1,0,1,0,0,0,0,0,0,0,0,0,0,0,0,0,0,0,0,0,0,0,0,0,0,0,0,1,0,0,0,0,0,1,0,1,0,1,0,3,0,24,22,1,1
X-Men: The Last Stand,2006,104,"Patrick Stewart, Hugh Jackman, Halle Berry",6.6,58.0,559718,234362462.0,210000000,459359555,6.409,9929,5,26,1,1,0,0,0,0,0,0,0,0,0,0,0,0,0,0,0,1,0,0,0,0,0,0,0,0,0,0,0,0,1,0,0,0,1,0,0,1,0,1,0,0,0,7,40,1,1
Zero Dark Thirty,2013,157,"Jessica Chastain, Joel Edgerton, Chris Pratt",7.4,95.0,331492,95720716.0,40000000,132800000,6.989,4650,1,11,0,0,0,0,0,0,0,1,0,0,0,1,0,0,0,0,0,0,0,1,0,0,0,0,0,0,0,0,0,0,0,1,0,0,0,0,0,1,0,1,0,1,0,85,174,0,1
Sonic the Hedgehog,2020,99,"Ben Schwartz, James Marsden, Jim Carrey",6.5,47.0,182243,148974665.0,85000000,319715683,7.306,10000,2,14,1,1,0,0,1,0,0,0,0,0,0,0,0,0,0,0,0,0,0,0,0,0,0,0,0,0,0,0,0,1,0,0,0,0,1,0,0,1,0,1,0,0,0,3,12,1,1
Trading Places,1983,116,"Eddie Murphy, Dan Aykroyd, Ralph Bellamy",7.5,69.0,174378,90404800.0,15000000,90404800,7.226,3424,6,8,0,0,0,0,1,0,0,0,0,0,0,0,0,0,0,0,0,0,0,0,0,0,0,0,0,0,0,0,0,0,0,1,0,0,1,0,0,1,0,1,0,0,1,3,8,0,1
The Visit,2015,94,"Olivia DeJonge, Ed Oxenbould, Deanna Dunagan",6.3,55.0,163760,65206105.0,5000000,98450062,6.318,4914,9,11,0,0,0,0,0,0,0,0,0,0,0,0,1,0,0,1,0,0,0,1,0,0,0,0,0,0,0,0,0,0,1,0,0,0,0,1,0,1,0,1,0,0,0,1,14,1,0
Law Abiding Citizen,2009,109,"Gerard Butler, Jamie Foxx, Leslie Bibb",7.4,34.0,334044,73357727.0,53000000,127900000,7.387,5361,10,16,1,0,0,0,0,1,0,1,0,0,0,0,0,0,0,0,0,0,0,0,0,0,0,0,0,0,0,0,0,0,0,1,0,0,0,0,0,1,0,1,0,0,0,3,5,1,1
Little Women,2019,135,"Saoirse Ronan, Emma Watson, Florence Pugh",7.8,91.0,270557,108101214.0,424000,2100000,6.8,138,12,25,0,0,0,0,0,0,0,1,0,0,0,0,0,0,0,0,1,0,0,0,0,0,0,0,0,0,0,0,0,1,0,0,0,0,0,0,0,1,0,1,0,1,0,73,230,1,1
