Title,Year,Runtime,Actors,IMDB Rating,Metascore,IMDB Votes,Box Office,Budget,Revenue,TMDB Rating,Vote Count,Month,Day,Action,Adventure,Animation,Biography,Comedy,Crime,Documentary,Drama,Family,Fantasy,Film-Noir,History,Horror,Music,Musical,Mystery,Romance,Sci-Fi,Sport,Thriller,War,Western,Approved,G,GP,M,M/PG,NC-17,Not Rated,PG,PG-13,R,TV-MA,Unrated,Top_Production_Company,Top_Director,Top_Writer,Domestic,International,English_Language,Other_Language,Oscars_Won,Oscars_Nominated,Wins,Nominations,Descr_Sentiment,Tagline_Sentiment
Think Like a Man,2012,122,"Chris Brown, Gabrielle Union, Kevin Hart",6.5,51.0,51750,91547205.0,12000000,96070507,6.793,856,4,20,0,0,0,0,1,0,0,0,0,0,0,0,0,0,0,0,1,0,0,0,0,0,0,0,0,0,0,0,0,0,1,0,0,0,0,0,0,1,0,1,0,0,0,3,14,0,1
Judas and the Black Messiah,2021,126,"LaKeith Stanfield, Daniel Kaluuya, Jesse Plemons",7.4,84.0,95537,5478009.0,26000000,6416063,7.312,1597,2,12,0,0,0,1,0,0,0,1,0,0,0,1,0,0,0,0,0,0,0,0,0,0,0,0,0,0,0,0,0,0,0,1,0,0,0,0,0,1,0,1,0,2,0,45,85,0,0
Hot Shots! Part Deux,1993,86,"Charlie Sheen, Lloyd Bridges, Valeria Golino",6.6,64.0,101297,38922972.0,25000000,133752825,6.5,1921,5,21,1,0,0,0,1,0,0,0,0,0,0,0,0,0,0,0,0,0,0,0,0,0,0,0,0,0,0,0,0,0,1,0,0,0,1,0,0,1,0,1,0,0,0,1,0,0,1
54,1998,93,"Ryan Phillippe, Salma Hayek, Neve Campbell",5.9,33.0,35169,16757163.0,13000000,16757163,5.868,493,8,28,0,0,0,0,0,0,0,1,0,0,0,0,0,1,0,0,0,0,0,0,0,0,0,0,0,0,0,0,0,0,0,1,0,0,0,0,0,1,0,1,0,0,0,0,9,1,1
Birth,2004,100,"Nicole Kidman, Cameron Bright, Lauren Bacall",6.3,51.0,42097,5095038.0,20000000,23900000,6.009,703,10,29,0,0,0,0,0,0,0,1,0,1,0,0,0,0,0,1,0,0,0,0,0,0,0,0,0,0,0,0,0,0,0,1,0,0,1,0,0,0,1,1,0,0,0,2,18,1,0
Lucas,1986,100,"Corey Haim, Kerri Green, Charlie Sheen",6.9,75.0,17893,8200000.0,6000000,8200000,6.7,242,3,28,0,0,0,0,1,0,0,1,0,0,0,0,0,0,0,0,1,0,0,0,0,0,0,0,0,0,0,0,0,0,1,0,0,0,1,0,0,1,0,1,0,0,0,0,3,0,1
Windtalkers,2002,134,"Nicolas Cage, Adam Beach, Peter Stormare",6.1,51.0,75512,40914068.0,115000000,77600000,6.3,1314,6,14,1,0,0,0,0,0,0,1,0,0,0,0,0,0,0,0,0,0,0,0,1,0,0,0,0,0,0,0,0,0,0,1,0,0,1,0,0,1,0,1,0,0,0,3,6,1,1
Fletch,1985,98,"Chevy Chase, Joe Don Baker, Dana Wheeler-Nicholson",6.9,68.0,59700,50612888.0,8000000,59612888,6.735,707,5,31,0,0,0,0,1,1,0,0,0,0,0,0,0,0,0,1,0,0,0,0,0,0,0,0,0,0,0,0,0,1,0,0,0,0,1,0,0,1,0,1,0,0,0,0,1,1,0
The Natural,1984,138,"Robert Redford, Robert Duvall, Glenn Close",7.4,61.0,53864,47951979.0,28000000,48000000,6.903,615,5,11,0,0,0,0,0,0,0,1,0,0,0,0,0,0,0,0,0,0,1,0,0,0,0,0,0,0,0,0,0,1,0,0,0,0,0,0,0,1,0,1,0,0,4,3,8,1,1
No Reservations,2007,104,"Catherine Zeta-Jones, Aaron Eckhart, Abigail Breslin",6.3,50.0,80834,43107979.0,28000000,92601050,6.7,1407,7,27,0,0,0,0,1,0,0,1,0,0,0,0,0,0,0,0,1,0,0,0,0,0,0,0,0,0,0,0,0,1,0,0,0,0,1,0,0,1,0,1,0,0,0,0,1,1,0
Inspector Gadget,1999,78,"Matthew Broderick, Rupert Everett, Joely Fisher",4.2,36.0,52622,97403112.0,75000000,134403112,4.488,1249,7,23,1,1,0,0,1,0,0,0,0,0,0,0,0,0,0,0,0,0,0,0,0,0,0,0,0,0,0,0,0,1,0,0,0,0,1,0,0,1,0,1,0,0,0,1,13,1,1
Machete Kills,2013,107,"Danny Trejo, Alexa PenaVega, Mel Gibson",5.6,41.0,84080,8008161.0,20000000,1750000,5.6,1943,10,11,1,0,0,0,1,1,0,0,0,0,0,0,0,0,0,0,0,0,0,0,0,0,0,0,0,0,0,0,0,0,0,1,0,0,1,0,0,1,0,1,0,0,0,0,3,0,0
First Reformed,2018,113,"Ethan Hawke, Amanda Seyfried, Cedric The Entertainer",7.1,86.0,64831,3448256.0,3500000,3988612,6.993,1374,6,8,0,0,0,0,0,0,0,1,0,0,0,0,0,0,0,1,0,0,0,1,0,0,0,0,0,0,0,0,0,0,0,1,0,0,0,0,1,1,0,1,0,0,1,62,109,0,0
Freddy Got Fingered,2001,87,"Tom Green, Rip Torn, Marisa Coughlan",4.7,13.0,53072,14254993.0,14000000,14343028,4.692,453,4,20,0,0,0,0,1,0,0,0,0,0,0,0,0,0,0,0,0,0,0,0,0,0,0,0,0,0,0,0,0,0,0,1,0,0,0,0,0,1,0,1,0,0,0,13,7,0,0
The Wedding Planner,2001,103,"Jennifer Lopez, Matthew McConaughey, Bridgette Wilson-Sampras",5.4,33.0,89095,60400856.0,35000000,94700000,5.931,1740,1,26,0,0,0,0,1,0,0,0,0,0,0,0,0,0,0,0,1,0,0,0,0,0,0,0,0,0,0,0,0,0,1,0,0,0,1,0,0,0,1,1,0,0,0,2,6,1,1
The Wolf of Snow Hollow,2020,85,"Jim Cummings, Riki Lindhome, Robert Forster",6.2,67.0,26339,185026.0,2000000,239828,6.056,452,10,9,0,0,0,0,1,0,0,0,0,0,0,0,1,0,0,1,0,0,0,0,0,0,0,0,0,0,0,0,0,0,0,1,0,0,0,0,0,1,0,1,0,0,0,0,5,0,1
Titan A.E.,2000,94,"Matt Damon, Drew Barrymore, Bill Pullman",6.6,48.0,65351,22753426.0,75000000,36754634,6.6,1116,6,16,1,1,1,0,0,0,0,0,0,0,0,0,0,0,0,0,0,0,0,0,0,0,0,0,0,0,0,0,0,1,0,0,0,0,1,0,0,1,0,1,0,0,0,1,6,1,1
The New Guy,2002,88,"DJ Qualls, Lyle Lovett, Eliza Dushku",5.8,24.0,38348,29760152.0,13000000,31200000,5.9,611,5,10,0,0,0,0,1,0,0,0,0,0,0,0,0,0,0,0,0,0,0,0,0,0,0,0,0,0,0,0,0,0,1,0,0,0,0,0,0,1,0,1,0,0,0,0,1,0,0
Assault on Precinct 13,2005,109,"Ethan Hawke, Laurence Fishburne, Gabriel Byrne",6.3,54.0,83453,20040895.0,30000000,35294470,6.175,1128,1,19,1,0,0,0,0,1,0,1,0,0,0,0,0,0,0,0,0,0,0,0,0,0,0,0,0,0,0,0,0,0,0,1,0,0,1,0,0,0,1,1,0,0,0,1,2,0,1
On the Road,2012,124,"Sam Riley, Garrett Hedlund, Kristen Stewart",6.0,56.0,43662,744296.0,25000000,8784318,5.612,863,5,23,0,1,0,0,0,0,0,1,0,0,0,0,0,0,0,0,1,0,0,0,0,0,0,0,0,0,0,0,0,0,0,1,0,0,0,0,0,0,1,1,0,0,0,2,4,1,1
Extremely Loud & Incredibly Close,2012,129,"Thomas Horn, Tom Hanks, Sandra Bullock",6.9,46.0,105897,31847881.0,40000000,55200000,6.979,2049,1,20,0,1,0,0,0,0,0,1,0,0,0,0,0,0,0,1,0,0,0,0,0,0,0,0,0,0,0,0,0,0,1,0,0,0,1,0,1,1,0,1,0,0,2,8,26,0,0
Phantasm,1979,89,"A. Michael Baldwin, Bill Thornbury, Reggie Bannister",6.6,72.0,42368,11988469.0,300000,11988469,6.5,719,3,28,0,0,0,0,0,0,0,0,0,0,0,0,1,0,0,0,0,1,0,0,0,0,0,0,0,0,0,0,0,0,0,1,0,0,0,0,0,1,0,1,0,0,0,2,2,1,0
High School Musical 3: Senior Year,2008,112,"Zac Efron, Vanessa Hudgens, Ashley Tisdale",5.0,57.0,70077,90559416.0,11000000,252909177,6.5,3512,10,24,0,0,0,0,1,0,0,1,1,0,0,0,0,0,0,0,0,0,0,0,0,0,0,1,0,0,0,0,0,0,0,0,0,0,1,0,0,1,0,1,0,0,0,8,9,1,1
Vertical Limit,2000,124,"Scott Glenn, Chris O'Donnell, Bill Paxton",6.0,48.0,67495,69243859.0,75000000,215663859,6.017,1062,12,8,1,1,0,0,0,0,0,1,0,0,0,0,0,0,0,0,0,0,0,0,0,0,0,0,0,0,0,0,0,0,1,0,0,0,1,0,0,0,1,1,0,0,0,2,4,1,1
The Three Stooges,2012,92,"Sean Hayes, Chris Diamantopoulos, Will Sasso",5.1,56.0,33951,44338224.0,30000000,54819301,5.8,604,4,13,0,0,0,0,1,0,0,0,1,0,0,0,0,0,0,0,0,0,0,0,0,0,0,0,0,0,0,0,0,1,0,0,0,0,1,0,0,1,0,1,0,0,0,0,4,1,0
The International,2009,118,"Clive Owen, Naomi Watts, Armin Mueller-Stahl",6.5,52.0,101774,25450527.0,50000000,60161391,6.248,1314,2,13,1,0,0,0,0,1,0,1,0,0,0,0,0,0,0,0,0,0,0,0,0,0,0,0,0,0,0,0,0,0,0,1,0,0,1,0,0,1,0,1,0,0,0,1,1,1,1
A Most Violent Year,2015,125,"Oscar Isaac, Jessica Chastain, David Oyelowo",6.9,79.0,80000,5749134.0,20000000,12007070,6.606,1452,1,30,0,0,0,0,0,1,0,1,0,0,0,0,0,0,0,0,0,0,0,1,0,0,0,0,0,0,0,0,0,0,0,1,0,0,0,0,0,1,0,1,0,0,0,15,52,1,1
Dahmer,2003,101,"Jeremy Renner, Bruce Davison, Artel Great",5.6,63.0,11990,144008.0,250000,144008,5.27,306,3,13,0,0,0,1,0,1,0,1,0,0,0,0,0,0,0,0,0,0,0,0,0,0,0,0,0,0,0,0,0,0,0,1,0,0,0,0,0,1,0,1,0,0,0,0,3,0,1
Cutthroat Island,1995,124,"Geena Davis, Matthew Modine, Frank Langella",5.7,37.0,32062,10017322.0,102000000,16000000,5.8,579,12,22,1,1,0,0,1,0,0,0,0,0,0,0,0,0,0,0,0,0,0,0,0,0,0,0,0,0,0,0,0,0,1,0,0,0,0,0,0,0,1,1,0,0,0,0,1,0,1
The Golden Child,1986,94,"Eddie Murphy, J.L. Reate, Charles Dance",6.0,37.0,62010,79817937.0,25000000,79817939,5.913,1113,12,12,1,1,0,0,1,0,0,0,0,0,0,0,0,0,0,0,0,0,0,0,0,0,0,0,0,0,0,0,0,0,1,0,0,0,1,0,0,1,0,1,0,0,0,0,2,0,1
The Watcher in the Woods,1981,84,"Bette Davis, Lynn-Holly Johnson, Kyle Richards",6.1,52.0,7539,5000000.0,9000000,5000000,5.9,143,10,9,0,0,0,0,0,0,0,0,1,0,0,0,1,0,0,1,0,0,0,0,0,0,0,0,0,0,0,0,0,1,0,0,0,0,0,0,0,0,1,1,0,0,0,1,4,1,0
Radio,2003,109,"Cuba Gooding Jr., Ed Harris, Debra Winger",6.9,38.0,44815,52333738.0,35000000,53293628,7.314,774,10,24,0,0,0,1,0,0,0,1,0,0,0,0,0,0,0,0,0,0,1,0,0,0,0,0,0,0,0,0,0,1,0,0,0,0,1,0,0,1,0,1,0,0,0,3,5,1,1
The Eagle,2011,114,"Channing Tatum, Jamie Bell, Donald Sutherland",6.2,55.0,76086,19490041.0,25000000,27122040,6.246,1343,2,11,1,1,0,0,0,0,0,1,0,0,0,0,0,0,0,0,0,0,0,0,0,0,0,0,0,0,0,0,0,0,1,0,0,0,1,0,0,0,1,1,0,0,0,0,1,1,1
Poltergeist,1982,114,"JoBeth Williams, Heather O'Rourke, Craig T. Nelson",7.3,79.0,187997,77177301.0,10700000,122200000,7.2,3127,6,4,0,0,0,0,0,0,0,0,0,0,0,0,1,0,0,0,0,0,0,1,0,0,0,0,0,0,0,0,0,1,0,0,0,0,1,0,0,1,0,1,0,0,3,5,9,0,1
Enough,2002,115,"Jennifer Lopez, Billy Campbell, Tessa Allen",5.8,25.0,48805,40007742.0,38000000,51800000,6.66,1184,5,24,0,0,0,0,0,1,0,1,0,0,0,0,0,0,0,0,0,0,0,1,0,0,0,0,0,0,0,0,0,0,1,0,0,0,0,0,0,1,0,1,0,0,0,0,4,0,0
Short Cuts,1993,188,"Andie MacDowell, Julianne Moore, Tim Robbins",7.6,81.0,48590,6110979.0,12000000,6110979,7.2,626,10,1,0,0,0,0,1,0,0,1,0,0,0,0,0,0,0,0,0,0,0,0,0,0,0,0,0,0,0,0,0,0,0,1,0,0,0,0,0,1,0,1,0,0,1,17,19,1,1
Colonia,2016,110,"Emma Watson, Daniel Brühl, Michael Nyqvist",7.0,33.0,58668,15709.0,14000000,3621046,7.252,1919,4,15,0,0,0,1,0,0,0,1,0,0,0,1,0,0,0,0,0,0,0,0,0,0,0,0,0,0,0,0,0,0,0,1,0,0,0,0,0,0,1,1,0,0,0,1,15,0,1
The First Purge,2018,97,"Y'lan Noel, Lex Scott Davis, Joivan Wade",5.2,54.0,75128,69488745.0,13000000,137056262,6.001,4073,7,4,1,0,0,0,0,0,0,0,0,0,0,0,1,0,0,0,0,1,0,0,0,0,0,0,0,0,0,0,0,0,0,1,0,0,1,0,0,1,0,1,0,0,0,0,1,1,1
Armageddon Time,2022,114,"Anne Hathaway, Jeremy Strong, Banks Repeta",6.5,74.0,17408,1872625.0,15000000,6524886,6.456,463,11,4,0,0,0,0,0,0,0,1,0,0,0,0,0,0,0,0,0,0,0,0,0,0,0,0,0,0,0,0,0,0,0,1,0,0,1,0,0,1,0,1,0,0,0,3,19,1,1
Mercury Rising,1998,111,"Bruce Willis, Miko Hughes, Alec Baldwin",6.1,37.0,79794,32935289.0,60000000,93100000,6.285,1568,4,3,1,0,0,0,0,1,0,1,0,0,0,0,0,0,0,0,0,0,0,0,0,0,0,0,0,0,0,0,0,0,0,1,0,0,1,0,0,1,0,1,0,0,0,2,0,1,0
Star Trek IV: The Voyage Home,1986,119,"William Shatner, Leonard Nimoy, DeForest Kelley",7.3,71.0,94291,109713132.0,21000000,133000000,7.152,1550,11,26,0,1,0,0,1,0,0,0,0,0,0,0,0,0,0,0,0,1,0,0,0,0,0,0,0,0,0,0,0,1,0,0,0,0,1,0,0,1,0,1,0,0,4,4,19,1,0
Congo,1995,109,"Laura Linney, Tim Curry, Dylan Walsh",5.3,22.0,49564,81022101.0,50000000,152022101,5.6,918,6,9,1,1,0,0,0,0,0,0,0,0,0,0,0,0,0,1,0,0,0,0,0,0,0,0,0,0,0,0,0,0,1,0,0,0,1,0,0,1,0,1,0,0,0,2,11,0,1
Nebraska,2014,115,"Bruce Dern, Will Forte, June Squibb",7.7,86.0,126214,17654912.0,12000000,27700000,7.443,1813,1,24,0,0,0,0,0,0,0,1,0,0,0,0,0,0,0,0,0,0,0,0,0,0,0,0,0,0,0,0,0,0,0,1,0,0,0,0,0,1,0,1,0,0,6,29,170,1,0
In the Cut,2003,119,"Meg Ryan, Mark Ruffalo, Jennifer Jason Leigh",5.4,47.0,26960,4750602.0,12000000,23726793,5.116,434,10,31,0,0,0,0,0,0,0,0,0,0,0,0,0,0,0,1,0,0,0,1,0,0,0,0,0,0,0,0,0,0,0,1,0,0,0,0,0,0,1,1,0,0,0,1,2,1,0
Mr. Bean's Holiday,2007,90,"Rowan Atkinson, Willem Dafoe, Steve Pemberton",6.4,56.0,138858,33302167.0,25000000,232225908,6.363,2948,8,24,0,0,0,0,1,0,0,0,1,0,0,0,0,0,0,0,0,0,0,0,0,0,0,1,0,0,0,0,0,0,0,0,0,0,0,0,0,0,1,1,0,0,0,0,2,0,0
Beverly Hills Cop III,1994,104,"Eddie Murphy, Jon Tenney, Joey Travolta",5.5,16.0,97794,42614912.0,50000000,119208989,5.875,1984,5,25,1,0,0,0,1,1,0,0,0,0,0,0,0,0,0,0,0,0,0,0,0,0,0,0,0,0,0,0,0,0,0,1,0,0,0,0,0,1,0,1,0,0,0,0,3,0,1
Once Upon a Time... in Hollywood,2019,161,"Leonardo DiCaprio, Brad Pitt, Margot Robbie",7.6,84.0,918707,142502728.0,95000000,392105159,7.426,14027,7,26,0,0,0,0,1,0,0,1,0,0,0,0,0,0,0,0,0,0,0,0,0,0,0,0,0,0,0,0,0,0,0,1,0,0,1,0,1,1,0,1,0,2,0,146,377,1,1
Diary of a Mad Black Woman,2005,116,"Kimberly Elise, Steve Harris, Tyler Perry",5.7,36.0,16309,50633099.0,5500000,50652203,6.527,224,2,25,0,0,0,0,1,0,0,1,0,0,0,0,0,0,0,0,1,0,0,0,0,0,0,0,0,0,0,0,0,0,1,0,0,0,1,0,0,1,0,1,0,0,0,13,13,1,1
Reindeer Games,2000,104,"Ben Affleck, Gary Sinise, Charlize Theron",5.8,37.0,43569,23368995.0,42000000,32168970,5.7,680,2,25,1,0,0,0,0,1,0,0,0,0,0,0,0,0,0,0,0,0,0,1,0,0,0,0,0,0,0,0,0,0,0,1,0,0,0,0,0,1,0,1,0,0,0,0,3,0,1
The Deep,1977,123,"Jacqueline Bisset, Nick Nolte, Dick Anthony Williams",6.2,41.0,14279,47346365.0,9000000,100000000,6.033,239,6,17,0,1,0,0,0,0,0,0,0,0,0,0,0,0,0,1,0,0,0,1,0,0,0,0,0,0,0,0,0,1,0,0,0,0,1,0,0,0,1,1,0,0,1,0,4,1,0
Young Adult,2011,94,"Charlize Theron, Patrick Wilson, Patton Oswalt",6.3,71.0,89219,16311571.0,12000000,22939027,5.813,1289,12,16,0,0,0,0,1,0,0,1,0,0,0,0,0,0,0,0,0,0,0,0,0,0,0,0,0,0,0,0,0,0,0,1,0,0,1,0,0,1,0,1,0,0,0,3,33,0,0
Police Academy 2: Their First Assignment,1985,87,"Steve Guttenberg, Bubba Smith, David Graf",5.8,39.0,61846,55600000.0,7600000,55600000,6.1,1617,3,29,0,0,0,0,1,0,0,0,0,0,0,0,0,0,0,0,0,0,0,0,0,0,0,0,0,0,0,0,0,0,1,0,0,0,1,0,0,1,0,1,0,0,0,1,0,0,1
The Mountain Between Us,2017,112,"Kate Winslet, Idris Elba, Beau Bridges",6.4,48.0,86125,30348555.0,35000000,62832209,6.652,2448,10,6,0,0,0,0,0,0,0,1,0,0,0,0,0,0,0,0,0,0,0,1,0,0,0,0,0,0,0,0,0,0,1,0,0,0,1,0,0,1,0,1,0,0,0,2,1,0,0
State of Play,2009,127,"Russell Crowe, Rachel McAdams, Ben Affleck",7.1,64.0,163935,37017955.0,60000000,87800000,6.804,2013,4,17,0,0,0,0,0,1,0,1,0,0,0,0,0,0,0,1,0,0,0,0,0,0,0,0,0,0,0,0,0,0,1,0,0,0,1,0,0,0,1,1,0,0,0,2,4,0,1
Step Up 2: The Streets,2008,98,"Robert Hoffman, Briana Evigan, Cassie Ventura",6.2,50.0,92093,58017783.0,23000000,150816700,6.688,2334,2,14,0,0,0,0,0,0,0,1,0,0,0,0,0,1,0,0,1,0,0,0,0,0,0,0,0,0,0,0,0,0,1,0,0,0,0,0,0,1,0,1,0,0,0,2,3,0,0
The Bad Batch,2017,118,"Suki Waterhouse, Jason Momoa, Jayda Fink",5.2,62.0,36272,180851.0,6000000,180851,5.263,1111,6,23,1,0,0,0,0,0,0,0,0,0,0,0,1,0,0,1,0,0,0,0,0,0,0,0,0,0,0,0,0,0,0,1,0,0,0,0,0,1,0,1,0,0,0,1,4,1,0
Raising Helen,2004,119,"Kate Hudson, John Corbett, Joan Cusack",6.0,38.0,38838,37486512.0,50000000,49700000,6.133,667,5,28,0,0,0,0,1,0,0,1,0,0,0,0,0,0,0,0,1,0,0,0,0,0,0,0,0,0,0,0,0,0,1,0,0,0,0,0,0,1,0,1,0,0,0,0,1,1,0
Money Monster,2016,98,"George Clooney, Julia Roberts, Jack O'Connell",6.5,55.0,109741,41012075.0,27000000,93282604,6.433,3038,5,13,1,0,0,0,0,1,0,1,0,0,0,0,0,0,0,0,0,0,0,0,0,0,0,0,0,0,0,0,0,0,0,1,0,0,0,0,0,1,0,1,0,0,0,0,2,0,0
About Last Night,2014,100,"Kevin Hart, Michael Ealy, Regina Hall",6.0,62.0,25601,48637684.0,12500000,49002684,6.0,509,2,14,0,0,0,0,1,0,0,0,0,0,0,0,0,0,0,0,1,0,0,0,0,0,0,0,0,0,0,0,0,0,0,1,0,0,0,0,0,1,0,1,0,0,0,0,1,1,1
House of Sand and Fog,2004,126,"Jennifer Connelly, Ben Kingsley, Ron Eldard",7.5,71.0,74544,13040288.0,16500000,16942795,7.2,788,1,9,0,0,0,0,0,1,0,1,0,0,0,0,0,0,0,0,0,0,0,0,0,0,0,0,0,0,0,0,0,0,0,1,0,0,1,0,0,1,0,1,0,0,3,13,42,0,0
The Forever Purge,2021,103,"Ana de la Reguera, Tenoch Huerta, Josh Lucas",5.4,53.0,46649,44539245.0,18000000,76994245,6.915,2563,7,2,1,0,0,0,0,1,0,1,0,0,0,0,0,0,0,0,0,0,0,0,0,0,0,0,0,0,0,0,0,0,0,1,0,0,1,0,0,1,0,1,0,0,0,1,0,0,0
Anatomy of a Murder,1959,161,"James Stewart, Lee Remick, Ben Gazzara",8.0,95.0,75195,11900000.0,2000000,8000000,7.9,1062,7,13,0,0,0,0,0,0,0,1,0,0,0,0,0,0,0,1,0,0,0,0,0,0,1,0,0,0,0,0,0,0,0,0,0,0,1,0,0,1,0,1,0,0,7,10,18,0,1
The Possession of Hannah Grace,2018,86,"Shay Mitchell, Grey Damon, Kirby Johnson",5.2,37.0,27526,14837422.0,9500000,43000000,5.6,1401,11,30,0,0,0,0,0,0,0,0,0,0,0,0,1,0,0,1,0,0,0,1,0,0,0,0,0,0,0,0,0,0,0,1,0,0,0,0,0,1,0,1,0,0,0,0,3,0,0
Dope,2015,103,"Shameik Moore, Tony Revolori, Kiersey Clemons",7.2,72.0,90699,17506470.0,7000000,17986781,7.062,1510,6,19,0,1,0,0,1,1,0,0,0,0,0,0,0,0,0,0,0,0,0,0,0,0,0,0,0,0,0,0,0,0,0,1,0,0,0,0,0,1,0,1,0,0,0,5,25,1,0
Mimic,1997,105,"Mira Sorvino, Jeremy Northam, Alexander Goodwin",6.0,56.0,57005,25480490.0,30000000,25480490,6.06,1160,8,22,0,0,0,0,0,0,0,0,0,0,0,0,1,0,0,0,0,1,0,0,0,0,0,0,0,0,0,0,0,0,0,1,0,0,0,0,0,1,0,1,0,0,0,3,8,0,1
Save the Last Dance,2001,112,"Julia Stiles, Sean Patrick Thomas, Kerry Washington",6.2,53.0,66894,91057006.0,13000000,131706809,6.5,1297,1,12,0,0,0,0,0,0,0,1,0,0,0,0,0,1,0,0,1,0,0,0,0,0,0,0,0,0,0,0,0,0,1,0,0,0,0,0,0,1,0,1,0,0,0,7,8,0,1
Alvin and the Chipmunks: Chipwrecked,2011,87,"Justin Long, Matthew Gray Gubler, Jesse McCartney",4.4,24.0,40910,133110742.0,75000000,342695435,5.702,2252,12,16,0,1,0,0,1,0,0,0,1,0,0,0,0,0,0,0,0,0,0,0,0,0,0,1,0,0,0,0,0,0,0,0,0,0,1,0,0,1,0,1,0,0,0,2,1,0,1
Fired Up!,2009,90,"Eric Christian Olsen, Nicholas D'Agosto, Sarah Roemer",6.1,31.0,46994,17231291.0,20000000,18599102,6.124,659,2,20,0,0,0,0,1,0,0,0,0,0,0,0,0,0,0,0,0,0,1,0,0,0,0,0,0,0,0,0,0,0,1,0,0,0,0,0,0,1,0,1,0,0,0,1,0,0,1
Confessions of a Teenage Drama Queen,2004,89,"Lindsay Lohan, Megan Fox, Adam Garcia",4.7,33.0,32077,29331068.0,15000000,29331068,5.707,919,2,20,0,0,0,0,1,0,0,0,1,0,0,0,0,1,0,0,0,0,0,0,0,0,0,0,0,0,0,0,0,1,0,0,0,0,1,0,0,0,1,1,0,0,0,1,0,1,0
Big Eyes,2014,106,"Amy Adams, Christoph Waltz, Danny Huston",7.0,62.0,102759,14482031.0,10000000,28900000,6.979,3525,12,25,0,0,0,1,0,1,0,1,0,0,0,0,0,0,0,0,0,0,0,0,0,0,0,0,0,0,0,0,0,0,1,0,0,0,0,1,0,1,0,1,0,0,0,3,18,0,1
Breaking Away,1979,101,"Dennis Christopher, Dennis Quaid, Daniel Stern",7.7,91.0,26160,16424918.0,2300000,20000000,7.131,272,7,20,0,0,0,0,1,0,0,1,0,0,0,0,0,0,0,0,0,0,1,0,0,0,0,0,0,0,0,0,0,1,0,0,0,0,1,0,0,1,0,1,0,1,0,11,14,0,1
Beautiful Girls,1996,112,"Matt Dillon, Timothy Hutton, Noah Emmerich",7.1,65.0,35644,10597759.0,16000000,27000000,6.6,374,2,9,0,0,0,0,1,0,0,1,0,0,0,0,0,0,0,0,1,0,0,0,0,0,0,0,0,0,0,0,0,0,0,1,0,0,0,0,0,1,0,1,0,0,0,1,4,0,0
An Education,2010,100,"Carey Mulligan, Peter Sarsgaard, Alfred Molina",7.2,85.0,139276,12574914.0,7500000,26100000,6.942,1344,2,5,0,0,0,0,0,0,0,1,0,0,0,0,0,0,0,0,0,0,0,0,0,0,0,0,0,0,0,0,0,0,1,0,0,0,0,0,0,0,1,1,0,0,3,36,96,1,0
The Book of Clarence,2024,129,"LaKeith Stanfield, Omar Sy, Anna Diop",5.7,57.0,7133,6132813.0,40000000,6205230,5.9,108,1,12,0,1,0,0,1,0,0,1,0,0,0,0,0,0,0,0,0,0,0,0,0,0,0,0,0,0,0,0,0,0,1,0,0,0,0,0,0,1,0,1,0,0,0,0,11,1,0
Flubber,1997,93,"Robin Williams, Marcia Gay Harden, Christopher McDonald",5.3,38.0,97679,92977226.0,80000000,178000000,5.653,2427,11,26,0,0,0,0,1,0,0,0,1,0,0,0,0,0,0,0,0,1,0,0,0,0,0,0,0,0,0,0,0,1,0,0,0,0,1,0,0,1,0,1,0,0,0,3,2,0,1
Red Lights,2012,114,"Sigourney Weaver, Robert De Niro, Cillian Murphy",6.2,36.0,68598,52624.0,14000000,13551174,6.185,1305,3,2,0,0,0,0,0,0,0,1,0,1,0,0,0,0,0,1,0,0,0,0,0,0,0,0,0,0,0,0,0,0,0,1,0,0,0,0,0,0,1,1,0,0,0,0,2,0,0
Girls Trip,2017,122,"Regina Hall, Queen Latifah, Jada Pinkett Smith",6.2,71.0,41848,115171585.0,19000000,140376621,6.844,1524,7,21,0,1,0,0,1,0,0,1,0,0,0,0,0,0,0,0,0,0,0,0,0,0,0,0,0,0,0,0,0,0,0,1,0,0,1,0,0,1,0,1,0,0,0,13,42,0,1
Strange World,2022,102,"Jake Gyllenhaal, Jaboukie Young-White, Gabrielle Union",5.7,65.0,47746,37968963.0,180000000,73621640,6.283,1330,11,23,1,1,1,0,0,0,0,0,0,0,0,0,0,0,0,0,0,0,0,0,0,0,0,0,0,0,0,0,0,1,0,0,0,0,1,0,0,1,0,1,0,0,0,0,9,0,0
The Spirit,2008,103,"Gabriel Macht, Samuel L. Jackson, Scarlett Johansson",4.7,30.0,63772,19806188.0,60000000,39031337,4.756,1010,12,25,1,0,0,0,0,1,0,0,0,1,0,0,0,0,0,0,0,0,0,0,0,0,0,0,0,0,0,0,0,0,1,0,0,0,1,0,0,1,0,1,0,0,0,0,4,1,1
The Rescuers,1977,77,"Bob Newhart, Eva Gabor, Geraldine Page",6.9,74.0,73143,71215869.0,7500000,169015869,6.778,2574,6,22,0,1,1,0,1,0,0,0,0,0,0,0,0,0,0,0,0,0,0,0,0,0,0,1,0,0,0,0,0,0,0,0,0,0,0,0,0,1,0,1,0,0,1,2,1,1,1
What a Girl Wants,2003,105,"Amanda Bynes, Colin Firth, Kelly Preston",5.8,41.0,67532,36105433.0,20000000,50700000,6.288,1652,4,4,0,0,0,0,1,0,0,1,1,0,0,0,0,0,0,0,0,0,0,0,0,0,0,0,0,0,0,0,0,1,0,0,0,0,1,0,0,1,0,1,0,0,0,1,0,0,1
Operation Finale,2018,122,"Oscar Isaac, Ben Kingsley, Mélanie Laurent",6.6,58.0,51494,17612099.0,24000000,17506878,6.707,1028,8,29,0,0,0,1,0,0,0,1,0,0,0,1,0,0,0,0,0,0,0,0,0,0,0,0,0,0,0,0,0,0,1,0,0,0,1,0,0,1,0,1,0,0,0,0,2,1,0
Thunderbolt and Lightfoot,1974,115,"Clint Eastwood, Jeff Bridges, George Kennedy",7.0,62.0,30541,21700000.0,4000000,25000000,6.768,567,5,24,1,0,0,0,1,1,0,0,0,0,0,0,0,0,0,0,0,0,0,0,0,0,0,0,0,0,0,0,0,0,0,1,0,0,1,0,0,1,0,1,0,0,1,0,1,1,1
Doctor Dolittle,1998,85,"Eddie Murphy, Peter Boyle, Ossie Davis",5.4,46.0,103722,144156605.0,71000000,294500000,5.712,3135,6,26,0,0,0,0,1,0,0,0,1,1,0,0,0,0,0,0,0,0,0,0,0,0,0,0,0,0,0,0,0,0,1,0,0,0,1,0,0,1,0,1,0,0,0,4,10,0,1
Star Trek: Generations,1994,118,"Patrick Stewart, William Shatner, Malcolm McDowell",6.6,55.0,89202,75671125.0,38000000,118071125,6.505,1391,11,18,1,1,0,0,0,0,0,0,0,0,0,0,0,0,0,1,0,0,0,0,0,0,0,0,0,0,0,0,0,1,0,0,0,0,1,0,0,1,0,1,0,0,0,2,4,0,1
Confessions of a Dangerous Mind,2003,113,"Sam Rockwell, Drew Barrymore, George Clooney",7.0,67.0,94120,16007718.0,30000000,33013805,6.695,1182,1,24,0,0,0,1,1,1,0,0,0,0,0,0,0,0,0,0,0,0,0,0,0,0,0,0,0,0,0,0,0,0,0,1,0,0,0,0,0,1,0,1,0,0,0,7,12,1,0
Darkman,1990,96,"Liam Neeson, Frances McDormand, Colin Friels",6.4,65.0,72622,33878502.0,16000000,48900000,6.432,1423,8,24,1,0,0,0,0,0,0,0,0,0,0,0,0,0,0,0,0,1,0,1,0,0,0,0,0,0,0,0,0,0,0,1,0,0,1,1,0,1,0,1,0,0,0,3,8,0,1
An American Tail,1986,80,"Dom DeLuise, Christopher Plummer, Erica Yohn",6.9,38.0,60096,47483002.0,9000000,84542002,6.732,1383,11,21,0,1,1,0,1,0,0,0,0,0,0,0,0,0,0,0,0,0,0,0,0,0,0,1,0,0,0,0,0,0,0,0,0,0,1,0,0,1,0,1,0,0,1,6,7,1,1
At Close Range,1986,116,"Sean Penn, Christopher Walken, Mary Stuart Masterson",6.9,67.0,19262,2347000.0,6500000,2347000,6.856,282,4,18,0,0,0,0,0,1,0,1,0,0,0,0,0,0,0,0,0,0,0,0,0,0,0,0,0,0,0,0,0,0,0,1,0,0,0,0,0,1,0,1,0,0,0,2,2,1,0
Peter Rabbit,2018,95,"James Corden, Fayssal Bazzi, Domhnall Gleeson",6.6,51.0,50590,115253424.0,50000000,351266433,6.7,1830,2,9,0,1,1,0,1,0,0,0,0,0,0,0,0,0,0,0,0,0,0,0,0,0,0,0,0,0,0,0,0,1,0,0,0,0,1,0,0,0,1,1,0,0,0,4,17,1,0
Romeo Must Die,2000,115,"Jet Li, Aaliyah, Isaiah Washington",6.1,52.0,75875,55973336.0,25000000,91036760,6.275,1236,3,22,1,0,0,0,0,1,0,0,0,0,0,0,0,0,0,0,0,0,0,1,0,0,0,0,0,0,0,0,0,0,0,1,0,0,1,0,0,1,0,1,0,0,0,2,7,1,0
Village of the Damned,1995,98,"Christopher Reeve, Kirstie Alley, Linda Kozlowski",5.6,41.0,35689,9418365.0,22000000,9418365,6.1,859,4,28,0,0,0,0,0,0,0,0,0,0,0,0,1,0,0,0,0,1,0,1,0,0,0,0,0,0,0,0,0,0,0,1,0,0,1,0,0,1,0,1,0,0,0,0,3,1,0
Alice Doesn't Live Here Anymore,1975,112,"Ellen Burstyn, Kris Kristofferson, Mia Bendixsen",7.3,78.0,28743,18600000.0,1800000,21000000,6.962,486,5,23,0,0,0,0,0,0,0,1,0,0,0,0,0,0,0,0,1,0,0,0,0,0,0,0,0,0,0,0,0,1,0,0,0,0,1,0,0,1,0,1,0,1,0,6,11,0,1
Rough Night,2017,101,"Scarlett Johansson, Kate McKinnon, Zoë Kravitz",5.2,51.0,57827,22105643.0,20000000,45056771,5.674,2031,6,16,0,0,0,0,1,0,0,0,0,0,0,0,0,0,0,0,0,0,0,0,0,0,0,0,0,0,0,0,0,0,0,1,0,0,1,0,0,1,0,1,0,0,0,1,1,1,0
New Jack City,1991,97,"Wesley Snipes, Ice-T, Allen Payne",6.6,61.0,40566,47624353.0,8500000,47624253,6.626,555,3,8,1,0,0,0,0,1,0,1,0,0,0,0,0,0,0,0,0,0,0,0,0,0,0,0,0,0,0,0,0,0,0,1,0,0,1,0,0,1,0,1,0,0,0,1,6,0,1
Bleed for This,2016,117,"Miles Teller, Aaron Eckhart, Katey Sagal",6.8,62.0,32585,5083906.0,6000000,6174491,6.8,800,11,18,0,0,0,1,0,0,0,1,0,0,0,0,0,0,0,0,0,0,1,0,0,0,0,0,0,0,0,0,0,0,0,1,0,0,0,0,0,1,0,1,0,0,0,1,3,0,1
BASEketball,1998,103,"Trey Parker, Matt Stone, Dian Bachar",6.5,38.0,68049,7027290.0,25000000,7027290,6.11,603,7,31,0,0,0,0,1,0,0,0,0,0,0,0,0,0,0,0,0,0,1,0,0,0,0,0,0,0,0,0,0,0,0,1,0,0,1,0,0,1,0,1,0,0,0,0,2,0,0
Gigli,2003,121,"Ben Affleck, Jennifer Lopez, Justin Bartha",2.7,18.0,51524,6087542.0,75600000,7266209,4.052,471,8,1,0,0,0,0,1,1,0,0,0,0,0,0,0,0,0,0,1,0,0,0,0,0,0,0,0,0,0,0,0,0,0,1,0,0,1,0,0,1,0,1,0,0,0,12,13,1,0
Hard Target,1993,97,"Jean-Claude Van Damme, Lance Henriksen, Yancy Butler",6.2,63.0,59110,32589677.0,18000000,74189677,6.5,1263,8,20,1,0,0,0,0,1,0,0,0,0,0,0,0,0,0,0,0,0,0,1,0,0,0,0,0,0,0,1,0,0,0,0,0,0,1,0,0,1,0,1,0,0,0,1,5,1,1
The Signal,2014,97,"Brenton Thwaites, Olivia Cooke, Beau Knapp",6.0,54.0,71372,600896.0,4000000,2665322,6.01,1728,7,10,0,0,0,0,0,0,0,1,0,0,0,0,0,0,0,1,0,1,0,0,0,0,0,0,0,0,0,0,0,0,1,0,0,0,1,0,0,1,0,1,0,0,0,1,3,0,0
Creepshow 2,1987,92,"George Kennedy, Lois Chiles, Domenick John",6.0,39.0,29831,14000000.0,3500000,14000000,6.2,606,5,1,0,0,0,0,0,0,0,0,0,1,0,0,1,0,0,0,0,0,0,0,0,0,0,0,0,0,0,0,0,0,0,1,0,0,0,0,0,1,0,1,0,0,0,0,1,0,1
Bull Durham,1988,108,"Kevin Costner, Susan Sarandon, Tim Robbins",7.0,73.0,62125,50888729.0,7000000,50888000,6.6,610,6,15,0,0,0,0,1,0,0,0,0,0,0,0,0,0,0,0,1,0,1,0,0,0,0,0,0,0,0,0,0,0,0,1,0,0,1,0,0,1,0,1,0,0,1,7,6,1,1
Barnyard,2006,90,"Kevin James, Courteney Cox, Danny Glover",5.6,42.0,35719,72637803.0,51000000,116755080,5.9,1121,8,4,0,1,1,0,1,0,0,0,0,0,0,0,0,0,0,0,0,0,0,0,0,0,0,0,0,0,0,0,0,1,0,0,0,0,1,0,0,1,0,1,0,0,0,0,3,0,0
Milk,2009,128,"Sean Penn, Josh Brolin, Emile Hirsch",7.5,83.0,181480,31841299.0,20000000,54600000,7.238,2275,1,30,0,0,0,1,0,0,0,1,0,0,0,1,0,0,0,0,0,0,0,0,0,0,0,0,0,0,0,0,0,0,0,1,0,0,1,0,0,1,0,1,0,2,0,66,145,1,0
The Station Agent,2003,89,"Peter Dinklage, Patricia Clarkson, Bobby Cannavale",7.6,81.0,75023,5739376.0,500000,8701337,7.356,712,12,5,0,0,0,0,1,0,0,1,0,0,0,0,0,0,0,0,0,0,0,0,0,0,0,0,0,0,0,0,0,0,0,1,0,0,0,0,0,1,0,1,0,0,0,29,31,0,0
K-19: The Widowmaker,2002,138,"Harrison Ford, Sam Spruell, Peter Stebbings",6.7,58.0,69928,35168966.0,100000000,65700000,6.551,1077,7,19,0,0,0,0,0,0,0,1,0,0,0,1,0,0,0,0,0,0,0,1,0,0,0,0,0,0,0,0,0,0,1,0,0,0,0,0,0,0,1,1,0,0,0,1,2,1,1
A Nightmare on Elm Street: The Dream Child,1989,89,"Robert Englund, Lisa Wilcox, Kelly Jo Minter",5.0,54.0,53205,22168359.0,8000000,22168359,5.408,1331,8,11,0,0,0,0,0,0,0,0,0,1,0,0,1,0,0,0,0,0,0,0,0,0,0,0,0,0,0,0,0,0,0,1,0,0,1,0,0,1,0,1,0,0,0,3,2,1,1
Hannah and Her Sisters,1986,107,"Mia Farrow, Dianne Wiest, Michael Caine",7.8,90.0,78894,40084041.0,6400000,40084041,7.504,1082,3,14,0,0,0,0,1,0,0,1,0,0,0,0,0,0,0,0,0,0,0,0,0,0,0,0,0,0,0,0,0,0,1,0,0,0,1,0,1,1,0,1,0,3,0,27,28,0,1
Ghost Town,2008,102,"Ricky Gervais, Greg Kinnear, Téa Leoni",6.7,72.0,79539,13367624.0,20000000,27100000,6.533,1001,9,19,0,0,0,0,1,0,0,1,0,1,0,0,0,0,0,0,0,0,0,0,0,0,0,0,0,0,0,0,0,0,1,0,0,0,1,0,0,1,0,1,0,0,0,3,2,1,0
SpaceCamp,1986,107,"Kate Capshaw, Lea Thompson, Kelly Preston",5.8,40.0,16406,9697739.0,18000000,9697739,5.841,189,6,6,0,1,0,0,0,0,0,0,1,0,0,0,0,0,0,0,0,1,0,0,0,0,0,0,0,0,0,0,0,1,0,0,0,0,0,0,0,1,0,1,0,0,0,0,1,0,1
About Schmidt,2003,125,"Jack Nicholson, Hope Davis, Dermot Mulroney",7.2,85.0,136363,65016287.0,30000000,105834556,6.848,1288,1,3,0,0,0,0,0,0,0,1,0,0,0,0,0,0,0,0,0,0,0,0,0,0,0,0,0,0,0,0,0,0,0,1,0,0,1,0,0,1,0,1,0,0,2,25,71,1,1
What Men Want,2019,117,"Taraji P. Henson, Kristen Ledlow, Josh Brener",5.4,49.0,33198,54611903.0,20000000,69766483,6.212,1501,2,8,0,0,0,0,1,0,0,0,0,1,0,0,0,0,0,0,1,0,0,0,0,0,0,0,0,0,0,0,0,0,0,1,0,0,1,0,0,1,0,1,0,0,0,1,0,1,1
Land of the Lost,2009,102,"Will Ferrell, Danny McBride, Anna Friel",5.3,32.0,77829,49438370.0,100000000,68688831,5.438,1354,6,5,1,1,0,0,1,0,0,0,0,0,0,0,0,0,0,0,0,0,0,0,0,0,0,0,0,0,0,0,0,0,1,0,0,0,1,0,0,1,0,1,0,0,0,2,9,1,0
